{
  "schema_version": "1.0",
  "asset": {
    "name": "Synthetic Honeypot Fixture",
    "symbol": "TEST-HNY",
    "contract_address": "0x1111111111111111111111111111111111111111",
    "chain": "Ethereum",
    "identity_verified": true,
    "fixture": true
  },
  "as_of": "2026-07-18T00:00:00Z",
  "sources": [
    {
      "id": "synthetic-honeypot-source",
      "name": "Synthetic deterministic test evidence",
      "retrieved_at": "2026-07-18T00:00:00Z"
    }
  ],
  "areas": {
    "contract_control": {
      "status": "available",
      "findings": [
        {
          "id": "no_arbitrary_balance_control",
          "summary": "The synthetic fixture contains no arbitrary balance-control finding.",
          "severity": "pass",
          "verified": true,
          "source_ids": [
            "synthetic-honeypot-source"
          ]
        }
      ],
      "unknown_checks": []
    },
    "sellability": {
      "status": "available",
      "findings": [
        {
          "id": "verified_sell_blocker",
          "summary": "Controlled sell simulation failed while buys succeeded, indicating a verified sell blocker.",
          "severity": "critical",
          "verified": true,
          "source_ids": [
            "synthetic-honeypot-source"
          ]
        }
      ],
      "unknown_checks": []
    },
    "liquidity": {
      "status": "available",
      "findings": [
        {
          "id": "liquidity_observed",
          "summary": "Liquidity evidence was present in the synthetic fixture.",
          "severity": "pass",
          "verified": true,
          "source_ids": [
            "synthetic-honeypot-source"
          ]
        }
      ],
      "unknown_checks": []
    },
    "holder_concentration": {
      "status": "available",
      "findings": [
        {
          "id": "holders_reviewed",
          "summary": "Holder evidence was present and contained no additional critical condition in the synthetic fixture.",
          "severity": "pass",
          "verified": true,
          "source_ids": [
            "synthetic-honeypot-source"
          ]
        }
      ],
      "unknown_checks": []
    }
  },
  "limitations": []
}
